{
  "metadata": {
    "project_name": "",
    "report_slug": "",
    "report_type": "monthly-deep-dive",
    "delivery_channel": "markdown",
    "summary_doc_mode": "per_run",
    "detail_doc_mode": "single_child",
    "preserve_existing_content": true,
    "market_scope": {
      "target_app": "",
      "target_app_store_url": "",
      "platforms": [],
      "primary_market": "",
      "secondary_markets": [],
      "target_keywords": []
    },
    "primary_market": "",
    "secondary_markets": [],
    "comparison_window": "",
    "latest_collection_at": "",
    "report_path": "",
    "evidence_path": ""
  },
  "report_rendering": {
    "primary_audience": "product_aso_lead",
    "name_first": true,
    "body_uses_app_id": false,
    "body_uses_app_links": true,
    "main_sections": [
      "决策入口层",
      "一句话结论",
      "Name Collision / Ambiguity Alert",
      "目标产品关键词表现",
      "竞品动态",
      "建议行动",
      "Optional Context",
      "Detail Delivery Context",
      "Back To Main Summary",
      "研究证据层",
      "目标产品关键词详细证据",
      "竞品 Name / Title / Top-3 Screenshot 证据",
      "Release Context",
      "Evidence Appendix",
      "Limitations"
    ]
  },
  "delivery_outputs": {
    "summary_doc": {
      "doc_id": "",
      "doc_url": "",
      "title": ""
    },
    "detail_doc": {
      "doc_id": "",
      "doc_url": "",
      "title": ""
    }
  },
  "summary_cards": [
    {
      "question": "",
      "answer": "",
      "action": ""
    },
    {
      "question": "",
      "answer": "",
      "action": ""
    },
    {
      "question": "",
      "answer": "",
      "action": ""
    }
  ],
  "market_snapshot": {
    "summary": {
      "state": "",
      "key_change_chain": []
    },
    "comparison_matrix": []
  },
  "release_analysis": {
    "apps": [
      {
        "app_name": "",
        "app_id": "",
        "app_store_url": "",
        "current_version": "",
        "updated_at": "",
        "within_30d": false,
        "whats_new_raw": "",
        "whats_new_summary": "",
        "release_theme": "",
        "user_visible_change": "none"
      }
    ]
  },
  "material_analysis": {
    "apps": [
      {
        "app_name": "",
        "app_id": "",
        "app_store_url": "",
        "screenshot_collection_status": "tool_present",
        "screenshot_sources": [],
        "device_coverage": "unknown",
        "webpage_screenshot_evidence": [],
        "web_fallback_used": false,
        "top3": [
          {
            "position": 1,
            "semantic_summary": "",
            "inferred": false
          }
        ]
      }
    ],
    "changes": [
      {
        "app_name": "",
        "app_id": "",
        "app_store_url": "",
        "changed": null,
        "before_theme": null,
        "after_theme": "",
        "message_shift": "",
        "likely_reason": "",
        "change_chain": [],
        "screenshot_collection_status": "tool_present",
        "screenshot_sources": [],
        "device_coverage": "unknown",
        "webpage_screenshot_evidence": [],
        "web_fallback_used": false,
        "inferred": false
      }
    ]
  },
  "keyword_analysis": {
    "rank_tracking": [
      {
        "keyword": "",
        "target_rank": null,
        "previous_rank": null,
        "delta": null,
        "leader_app_name": "",
        "leader_rank": null,
        "leader_app_store_url": "",
        "collected_at": "",
        "target_keyword_source": "",
        "target_keyword_last_verified_at": "",
        "leader_app_id": "",
        "traffic_score": null,
        "difficulty_score": null,
        "change_chain": [],
        "alert_type": "",
        "note": ""
      }
    ],
    "alerts": {
      "at_risk_target_keywords": [],
      "recoverable_target_keywords": [],
      "notes": []
    }
  },
  "limitations": []
}
